{
  "schemaVersion" : "matching.m11.replay.v1",
  "status" : "PASS",
  "replayInterpreter" : "M11_TYPED_STEP_INTERPRETER_V2",
  "persistedBytesSha256" : "bd14422bedc830ab9d63fb2441d2e18aa5d48da61c3aaea3cefc669e3397786d",
  "persistedBytesParsed" : true,
  "required" : 10,
  "replayed" : 10,
  "orderedUniqueIds" : true,
  "stepCountsExact" : true,
  "freshCandidatePerReplay" : true,
  "productionControlsPassed" : 10,
  "fingerprintsExact" : true,
  "oneDeleteAudits" : 10,
  "invalidHistoryCountedAsKill" : false,
  "systemErrorCountedAsKill" : false,
  "canonicalSha256" : "30bfdad011b7460838e8b3166053429ef9ac1d20d197f76fa21496cc5f3ec23a",
  "results" : [ {
    "counterexampleId" : "cex-m11-offer-as-success",
    "mutant" : "M11-OFFER-AS-SUCCESS",
    "classification" : "STUDENT_FAILURE",
    "fingerprint" : "INGRESS_OFFER_UPGRADED_TO_BUSINESS_SUCCESS",
    "steps" : 1,
    "actualMutationActions" : 1,
    "freshCandidate" : true,
    "freshProductionControl" : true,
    "fingerprintExact" : true,
    "oneMinimal" : true
  }, {
    "counterexampleId" : "cex-m11-session-as-identity",
    "mutant" : "M11-SESSION-AS-IDENTITY",
    "classification" : "STUDENT_FAILURE",
    "fingerprint" : "SESSION_CHANGED_BUSINESS_IDENTITY",
    "steps" : 2,
    "actualMutationActions" : 2,
    "freshCandidate" : true,
    "freshProductionControl" : true,
    "fingerprintExact" : true,
    "oneMinimal" : true
  }, {
    "counterexampleId" : "cex-m11-correlation-as-identity",
    "mutant" : "M11-CORRELATION-AS-IDENTITY",
    "classification" : "STUDENT_FAILURE",
    "fingerprint" : "CORRELATION_CHANGED_BUSINESS_IDENTITY",
    "steps" : 2,
    "actualMutationActions" : 2,
    "freshCandidate" : true,
    "freshProductionControl" : true,
    "fingerprintExact" : true,
    "oneMinimal" : true
  }, {
    "counterexampleId" : "cex-m11-respond-before-bind",
    "mutant" : "M11-RESPOND-BEFORE-BIND",
    "classification" : "STUDENT_FAILURE",
    "fingerprint" : "RESPONSE_OBSERVED_BEFORE_RESULT_BIND",
    "steps" : 3,
    "actualMutationActions" : 2,
    "freshCandidate" : true,
    "freshProductionControl" : true,
    "fingerprintExact" : true,
    "oneMinimal" : true
  }, {
    "counterexampleId" : "cex-m11-drop-identity-from-snapshot",
    "mutant" : "M11-DROP-IDENTITY-FROM-SNAPSHOT",
    "classification" : "STUDENT_FAILURE",
    "fingerprint" : "SNAPSHOT_LOST_IDEMPOTENCY_TABLE",
    "steps" : 4,
    "actualMutationActions" : 1,
    "freshCandidate" : true,
    "freshProductionControl" : true,
    "fingerprintExact" : true,
    "oneMinimal" : true
  }, {
    "counterexampleId" : "cex-m11-corrupt-snapshot-to-genesis",
    "mutant" : "M11-CORRUPT-SNAPSHOT-TO-GENESIS",
    "classification" : "STUDENT_FAILURE",
    "fingerprint" : "CORRUPT_SNAPSHOT_SILENTLY_BECAME_GENESIS",
    "steps" : 5,
    "actualMutationActions" : 1,
    "freshCandidate" : true,
    "freshProductionControl" : true,
    "fingerprintExact" : true,
    "oneMinimal" : true
  }, {
    "counterexampleId" : "cex-m11-reject-n-minus-one",
    "mutant" : "M11-REJECT-N-MINUS-ONE",
    "classification" : "STUDENT_FAILURE",
    "fingerprint" : "N_MINUS_ONE_COMPATIBILITY_REJECTED",
    "steps" : 1,
    "actualMutationActions" : 1,
    "freshCandidate" : true,
    "freshProductionControl" : true,
    "fingerprintExact" : true,
    "oneMinimal" : true
  }, {
    "counterexampleId" : "cex-m11-include-runtime-metadata-in-digest",
    "mutant" : "M11-INCLUDE-RUNTIME-METADATA-IN-DIGEST",
    "classification" : "STUDENT_FAILURE",
    "fingerprint" : "RUNTIME_METADATA_CHANGED_BUSINESS_DIGEST",
    "steps" : 3,
    "actualMutationActions" : 2,
    "freshCandidate" : true,
    "freshProductionControl" : true,
    "fingerprintExact" : true,
    "oneMinimal" : true
  }, {
    "counterexampleId" : "cex-m11-double-write-local-wal",
    "mutant" : "M11-DOUBLE-WRITE-LOCAL-WAL",
    "classification" : "STUDENT_FAILURE",
    "fingerprint" : "CLUSTER_SERVICE_WROTE_STANDALONE_WAL",
    "steps" : 1,
    "actualMutationActions" : 1,
    "freshCandidate" : true,
    "freshProductionControl" : true,
    "fingerprintExact" : true,
    "oneMinimal" : true
  }, {
    "counterexampleId" : "cex-m11-accept-unsupported-version",
    "mutant" : "M11-ACCEPT-UNSUPPORTED-VERSION",
    "classification" : "STUDENT_FAILURE",
    "fingerprint" : "UNSUPPORTED_VERSION_ACCEPTED",
    "steps" : 1,
    "actualMutationActions" : 1,
    "freshCandidate" : true,
    "freshProductionControl" : true,
    "fingerprintExact" : true,
    "oneMinimal" : true
  } ]
}
